{
  "id": "REQ-0003",
  "type": "development",
  "title": "Lỗ hổng gate mức thấp còn lại sau REQ-0002",
  "description": "Tách từ REQ-0002 (DEC-0055, ART-0026): L6 risk_report created_by guard giả được vì mọi agent ghi được .agents/artifacts/; L7 không khoá file nên hai lệnh song song có thể dùng chung một phiếu; L8 pytest chạy mã tuỳ ý (đã chấp nhận ở DEC-0050); MCP server khác github chưa qua gate.",
  "workflow": "standard-v1",
  "status": "intake",
  "waiting_on": [],
  "token_budget": 300000,
  "token_used": 0,
  "created_at": "2026-10-30T23:20:00Z"
}
